B1: Google Company Analysis Prepared by Matt Decuir Exhibit 14 – Company Valuation and Assumptions

A1: Valuation (in millions)
A2: PV(Free Cash Flows) | B2: 109075.2290152952
A3: PV(Continuing Free Cash Flows) | B3: 47734.060104145443
A4: Less Debt Liabilities | B4: 0
A5: Less Preferred Equity | B5: 0
A6: Common Equity value | B6: =(B2+B3-B4-B5) -> 156809.28911944065
A7: Shares Outstanding | B7: 311.55
A8: Value per share (not in millions) | B8: =B6/B7 -> 503.31981742718875
A9: Last Market price (not in millions) | B9: 504.77
A10: Difference | B10: =B8-B9 -> -1.4501825728112294

A1: Capital Asset Pricing Model
A2: Risk Free Rate | B2: 5.2400000000000002E-2
A3: Market Risk Premium | B3: 0.07
A4: Beta | B4: 1.1960334741607872
A6: CAPM = | B6: =$B$2+($B$4*$B$3) -> 0.1361223431912551

A1: Weighted Average Cost of Capital
A2: Ke | B2: 0.1361223431912551
A3: We | B3: 1
A4: Ks | B4: =B2 -> 0.1361223431912551
A5: Ws | B5: 0
A6: Rd | B6: 0.1
A7: Wd | B7: 0
A8: Tc | B8: 0.35
A10: WACC = | B10: =$B$2*B3 +$B$4*$B$5 + $B$6*(1-$B$8) * $B$7 -> 0.1361223431912551

A1: Beta Calculations:
B2: Yahoo | C2: Microsoft | D2: Google
A3: Beta (a) | B3: 1.6197524171401148 | C3: 1.108884263184085 | D3: 1.2925872748668463
A4: Standard Error | B4: 0.17032601185684557 | C4: 8.2087027567503371E-2 | D4: 0.28982880866844385
A6: Adjusted Beta | B6: 1.4152341194838771 | C6: 1.072952456333337 | D6: 1.1960334741607872
A8: Industry Average Beta (b) | C8: 1.2440932879086071
A9: Google's Adjusted Beta | C9: 1.1960334741607872
A11: (a) Beta calculated using weekly returns starting January 1, 2002, and ending June 8, 2007, using the S&P 500 as the market index.
A14: (b) Industry Average beta calculated using equal weighting of Yahoo and Microsoft's adjusted betas.